[{
  "@context": "http://www.w3.org/ns/odrl.jsonld",
  "uid": "http://example.com/policy/cause-cap2-cap1",
  "type": "Set",
  "permission": [{
      "assignee": "http://example.com/edge/cap1",
      "target": "http://example.com/change-direction",
      "action": "execute",
      "duty": [{
          "action": {
            "id": "inform",
            "refinement": [{
                "leftOperand": "event",
                "operator": "eq",
                "rightOperand": "https://www.wikidata.org/wiki/Q131437603"
              }]
          },
          "target": "http://example.com/cap2/data-ObjectDetected",
          "informedParty": "http://example.com/edge/cap1",
          "informingParty": "http://example.com/edge/cap2"
        }],
      "constraint": [{
       "leftOperand": "event",
              "operator": "lt",
              "rightOperand": { "@id": "odrl:policyUsage" }
        }]
    }]
}
]